term,group_count,overall_count,exact_pval,sig,genes
unfolded protein binding,9,67,0.07062811458214589,FALSE,YAL005C YBR072W YDR171W YER103W YJR032W YLL026W YNL156C YOR020C YPL240C
acyltransferase activity,20,185,0.07795128823316017,FALSE,YBR177C YBR280C YDL132W YDR177W YDR264C YFL009W YFL024C YGL084C YGR149W YGR184C YHR166C YKL008C YKL034W YKL182W YKR067W YMR298W YNL172W YOL076W YOL110W YPR131C
ubiquitin-like protein binding,6,43,0.11025258058371352,FALSE,YCL008C YER143W YFL009W YJL112W YLR421C YNR006W
guanyl-nucleotide exchange factor activity,6,45,0.12986063526244676,FALSE,YAL024C YDR246W YER019C-A YLR371W YPL048W YPR017C
glycosyltransferase activity,10,92,0.17062710808659826,FALSE,YEL011W YER001W YFR015C YGL038C YGL047W YGL142C YIL085C YML100W YNL192W YOR085W
hydrolase activity,50,567,0.1862073190348245,FALSE,YAL005C YBR067C YBR139W YBR177C YBR245C YBR252W YCL057W YCR026C YDL007W YDL125C YDL192W YDR074W YDR258C YDR287W YDR319C YER019W YER143W YFL044C YGL037C YGR101W YGR248W YGR282C YIL124W YJL001W YJL102W YJR142W YKL113C YKL114C YKL145W YLL026W YLR019W YLR086W YLR361C YML060W YML091C YML100W YMR008C YMR173W YMR287C YNL045W YNL053W YNL090W YNL186W YNL238W YNL330C YOR059C YOR166C YOR208W YOR262W YPL240C
ATP hydrolysis activity,9,83,0.18879990850149891,FALSE,YAL005C YBR245C YDL007W YDR258C YKL145W YLL026W YLR086W YMR173W YPL240C
peptidase activity,9,85,0.20763717691103817,FALSE,YBR139W YCL057W YER143W YFL044C YGR101W YJL001W YNL045W YNL186W YNL238W
enzyme regulator activity,23,249,0.21387104757476932,FALSE,YAL024C YDR246W YER012W YER019C-A YER136W YGR042W YGR100W YIL153W YJL144W YJR138W YKL201C YLR006C YLR371W YML058W YML100W YMR199W YNL157W YOR014W YPL048W YPL137C YPR017C YPR120C YPR175W
chromatin binding,11,110,0.22793743425815935,FALSE,YBR060C YBR245C YDL003W YGL207W YIL026C YIL076W YLR086W YML069W YOR119C YOR144C YPR135W
DNA binding,29,324,0.23079159104856242,FALSE,YAL051W YAR007C YBL054W YBR060C YBR073W YBR245C YCR065W YDL020C YDL132W YDR099W YDR224C YDR225W YDR421W YER095W YGR104C YHL025W YHR006W YJL173C YJR060W YKL049C YKR091W YNL261W YNL312W YOL089C YOR014W YPL048W YPL089C YPL127C YPR175W
isomerase activity,6,56,0.26179781059734325,FALSE,YDR155C YHR057C YIL153W YJR032W YKL195W YMR105C
oxidoreductase activity,24,270,0.2669575178526816,FALSE,YDL015C YDL124W YDR044W YDR513W YGL039W YGL185C YIL124W YIR038C YJR104C YJR139C YKL085W YKL086W YKL182W YKL195W YLR043C YLR100W YLR109W YML080W YNR060W YOL151W YOR085W YOR374W YPL061W YPL171C
protein-macromolecule adaptor activity,10,116,0.4073225018643714,FALSE,YBR005W YDL132W YDR422C YER143W YGL178W YGR077C YJL128C YLL021W YLR026C YOL111C
kinase activity,15,182,0.43809914067957534,FALSE,YBL105C YDL108W YDR422C YFR053C YHL007C YHR135C YJL128C YJL165C YJR059W YKL024C YKL139W YLR133W YMR139W YOL016C YOR119C
GTPase activity,5,59,0.48293957106491303,FALSE,YDL192W YJL102W YMR173W YNL090W YOR262W
lipid binding,9,117,0.556581438381722,FALSE,YDL019C YFL014W YHR001W YLR371W YMR054W YMR175W YNR006W YPL048W YPL100W
DNA-binding transcription factor activity,8,106,0.5811551464461584,FALSE,YAL051W YCR065W YDL020C YDR421W YHR006W YJR060W YPL048W YPL089C
transmembrane transporter activity,21,278,0.5833552294784838,FALSE,YBR008C YBR021W YCL025C YDL217C YDR352W YDR456W YGL080W YGL255W YGR217W YGR281W YHL016C YHR092C YJL054W YJL094C YJL143W YML038C YMR054W YOL122C YOR045W YOR291W YPR128C
transferase activity,55,719,0.5885664557083343,FALSE,YBL105C YBR177C YBR280C YDL108W YDL132W YDL201W YDR177W YDR264C YDR316W YDR422C YDR513W YEL011W YER001W YFL009W YFL024C YFR015C YFR053C YGL038C YGL047W YGL084C YGL142C YGR149W YGR184C YHL007C YHR135C YHR166C YIL085C YIR038C YJL128C YJL165C YJR059W YJR073C YKL008C YKL024C YKL034W YKL139W YKL182W YKR067W YLR133W YLR438W YML008C YML100W YMR139W YMR298W YNL172W YNL192W YOL005C YOL016C YOL076W YOL110W YOR021C YOR085W YOR119C YPR131C YPR175W
phosphatase activity,7,96,0.6197908059094743,FALSE,YDR074W YDR287W YLR019W YLR361C YML100W YNL053W YOR208W
nuclease activity,5,76,0.7092144812410122,FALSE,YKL113C YKL114C YML091C YMR287C YOR166C
cytoskeletal protein binding,5,77,0.720090947711046,FALSE,YBL031W YDR016C YIL034C YLR200W YOR058C
lyase activity,5,80,0.7509713520762173,FALSE,YAL039C YKL087C YKL182W YML004C YPL262W
methyltransferase activity,5,81,0.76068513315863,FALSE,YDL201W YDR316W YJR073C YML008C YOR021C
enzyme binding,5,86,0.8050078609452997,FALSE,YDL003W YJR074W YKL145W YLR006C YPL137C
structural molecule activity,15,261,0.917082804072441,FALSE,YBR067C YBR146W YBR282W YDL202W YDL217C YDR115W YDR334W YDR462W YGR167W YKL096W-A YKR085C YLR439W YMR286W YNL005C YOR098C
ion binding,37,576,0.917316334086745,FALSE,YAL051W YAR007C YBL105C YBR024W YBR062C YCL057W YCR026C YDL125C YDR264C YDR421W YFL044C YGL037C YGL255W YGR184C YGR257C YHR006W YHR192W YIL108W YJR104C YKL034W YKL114C YLL026W YLR371W YML004C YMR244C-A YNL045W YNL186W YNL261W YNL330C YNR006W YNR020C YOL089C YOR052C YPL048W YPL100W YPR017C YPR056W
mRNA binding,10,189,0.9285240158358483,FALSE,YAR007C YBR072W YBR245C YDR155C YER035W YFR001W YGL178W YHL007C YKL085W YOR362C
structural constituent of ribosome,9,179,0.9432790298682144,FALSE,YBR146W YBR282W YDL202W YDR115W YDR462W YKR085C YLR439W YMR286W YNL005C
RNA binding,14,365,0.9994516884358298,FALSE,YAL005C YAR007C YBR072W YBR245C YDL092W YDR155C YER035W YFR001W YGL178W YHL007C YKL085W YNL147W YOR362C YPL178W
